{
  "username": "Johny A. Pedraza Romero",
  "headline": "Backend Architect in the making | AI-Augmented Development",
  "tagline": "Backend Engineer in Evolution",
  "description": "Currently focused on building robust APIs and exploring software architecture patterns for scalable systems. Passionate about clean architecture, domain-driven design, and AI-augmented development workflows.",
  "location": "La Habana, Cuba",
  "email": "johny.antonio.pedraza.romero@gmail.com",
  "phone": "+53 55002026",
  "languages": ["English", "Spanish"],
  "currentFocus": [
    {
      "title": "Software Architecture",
      "description": "Designing maintainable systems, understanding DDD, Clean Architecture, and system design principles."
    },
    {
      "title": "AI Engineering",
      "description": "Learning ML integration, building AI-powered features, and understanding LLM patterns."
    }
  ],
  "whatIBuild": [
    "APIs with FastAPI & NestJS",
    "Developer templates & boilerplates",
    "Clean Architecture patterns"
  ],
  "learningJourney": "Currently diving deep into system design and exploring how AI/ML can enhance developer productivity. Open to architecture discussions and collaboration!",
  "githubReadmeSummary": "Backend engineer building scalable, clean-architecture APIs with FastAPI, NestJS & .NET. Into DDD, developer tooling, and AI-augmented development.",
  "linkedinHeadline": "Backend Engineer | Clean Architecture & DDD | FastAPI · NestJS · .NET | Building scalable APIs and developer tooling | AI-Augmented Development",
  "cvHeadline": "Backend Engineer · Software Architecture · Clean Architecture & DDD",
  "portfolioHighlights": [
    "Ignix Core",
    "FastAPI Generic Scaffold",
    "NestJS Boilerplate",
    "FastAPI Template"
  ],
  "whatIBuildVariants": {
    "github": "Type-safe backend templates, clean-architecture scaffolds, and developer tooling.",
    "linkedin": "Scalable APIs and reusable backend architectures that help teams ship faster.",
    "cv": "Production-ready backend systems applying Clean Architecture, DDD, and SOLID principles.",
    "portfolio": "Backend frameworks, API scaffolds, and reusable developer templates."
  },
  "githubQuote": "Learning never stops — systems evolve, and so do we."
}
